{
  "schemaVersion": 1,
  "batchKey": "us-2026-08-13-north-13",
  "sourceRegister": "docs/research/us-outpost-cohort-north.md",
  "sourceVersion": "us-outpost-cohort-north-2026-08-13",
  "reviewedAt": "2026-08-13",
  "candidates": [
    {
      "candidateKey": "us-ne-va-bridge-community-warrenton",
      "operation": "new-listing",
      "targetHubOutpostId": null,
      "publicFacts": {
        "church": "The Bridge Community Church",
        "city": "Warrenton",
        "jurisdiction": "Virginia",
        "outpostNumber": null,
        "campusSuffix": null,
        "streetAddress": null,
        "postalCode": null,
        "district": null,
        "region": "Northeast Region",
        "fcfTerritory": null,
        "languageOverlay": null,
        "programs": [],
        "meeting": null,
        "contactUrl": null,
        "fcfActivityStatus": "not-verified"
      },
      "fieldSources": {
        "church": [
          {
            "url": "https://bridge4life.com/about-us/pastors-and-staff/",
            "label": "The Bridge Community Church — pastors and staff",
            "checkedAt": "2026-08-13",
            "factKind": "direct"
          }
        ],
        "city": [
          {
            "url": "https://bridge4life.com/about-us/pastors-and-staff/",
            "label": "The Bridge Community Church — pastors and staff",
            "checkedAt": "2026-08-13",
            "factKind": "direct"
          }
        ],
        "jurisdiction": [
          {
            "url": "https://bridge4life.com/about-us/pastors-and-staff/",
            "label": "The Bridge Community Church — pastors and staff",
            "checkedAt": "2026-08-13",
            "factKind": "direct"
          }
        ],
        "region": [
          {
            "url": "https://bridge4life.com/about-us/pastors-and-staff/",
            "label": "The Bridge Community Church — pastors and staff",
            "checkedAt": "2026-08-13",
            "factKind": "derived",
            "mappingSourceUrl": "https://royalrangers.com/~/-/media/F5F81CB2C829419A82139A817D8073A2.ashx"
          }
        ]
      }
    },
    {
      "candidateKey": "us-ne-de-victory-dover",
      "operation": "new-listing",
      "targetHubOutpostId": null,
      "publicFacts": {
        "church": "Victory Dover",
        "city": "Dover",
        "jurisdiction": "Delaware",
        "outpostNumber": null,
        "campusSuffix": null,
        "streetAddress": null,
        "postalCode": null,
        "district": "PennDel District",
        "region": "Northeast Region",
        "fcfTerritory": null,
        "languageOverlay": null,
        "programs": [],
        "meeting": null,
        "contactUrl": null,
        "fcfActivityStatus": "not-verified"
      },
      "fieldSources": {
        "church": [
          {
            "url": "https://victoryexperience.com/victory-dover/",
            "label": "Victory Dover — campus page",
            "checkedAt": "2026-08-13",
            "factKind": "direct"
          }
        ],
        "city": [
          {
            "url": "https://victoryexperience.com/victory-dover/",
            "label": "Victory Dover — campus page",
            "checkedAt": "2026-08-13",
            "factKind": "direct"
          }
        ],
        "jurisdiction": [
          {
            "url": "https://victoryexperience.com/victory-dover/",
            "label": "Victory Dover — campus page",
            "checkedAt": "2026-08-13",
            "factKind": "direct"
          }
        ],
        "region": [
          {
            "url": "https://victoryexperience.com/victory-dover/",
            "label": "Victory Dover — campus page",
            "checkedAt": "2026-08-13",
            "factKind": "derived",
            "mappingSourceUrl": "https://royalrangers.com/~/-/media/F5F81CB2C829419A82139A817D8073A2.ashx"
          }
        ],
        "district": [
          {
            "url": "https://victoryexperience.com/victory-dover/",
            "label": "Victory Dover — campus page",
            "checkedAt": "2026-08-13",
            "factKind": "derived",
            "mappingSourceUrl": "https://royalrangers.com/~/-/media/F5F81CB2C829419A82139A817D8073A2.ashx"
          }
        ]
      }
    },
    {
      "candidateKey": "us-ne-md-delmarva-evangelistic-salisbury",
      "operation": "new-listing",
      "targetHubOutpostId": null,
      "publicFacts": {
        "church": "Delmarva Evangelistic Church",
        "city": "Salisbury",
        "jurisdiction": "Maryland",
        "outpostNumber": null,
        "campusSuffix": null,
        "streetAddress": null,
        "postalCode": null,
        "district": "Potomac District",
        "region": "Northeast Region",
        "fcfTerritory": null,
        "languageOverlay": null,
        "programs": [],
        "meeting": null,
        "contactUrl": null,
        "fcfActivityStatus": "not-verified"
      },
      "fieldSources": {
        "church": [
          {
            "url": "https://www.decsalisbury.com/",
            "label": "Delmarva Evangelistic Church — home",
            "checkedAt": "2026-08-13",
            "factKind": "direct"
          }
        ],
        "city": [
          {
            "url": "https://www.decsalisbury.com/",
            "label": "Delmarva Evangelistic Church — home",
            "checkedAt": "2026-08-13",
            "factKind": "direct"
          }
        ],
        "jurisdiction": [
          {
            "url": "https://www.decsalisbury.com/",
            "label": "Delmarva Evangelistic Church — home",
            "checkedAt": "2026-08-13",
            "factKind": "direct"
          }
        ],
        "region": [
          {
            "url": "https://www.decsalisbury.com/",
            "label": "Delmarva Evangelistic Church — home",
            "checkedAt": "2026-08-13",
            "factKind": "derived",
            "mappingSourceUrl": "https://royalrangers.com/~/-/media/F5F81CB2C829419A82139A817D8073A2.ashx"
          }
        ],
        "district": [
          {
            "url": "https://www.decsalisbury.com/",
            "label": "Delmarva Evangelistic Church — home",
            "checkedAt": "2026-08-13",
            "factKind": "derived",
            "mappingSourceUrl": "https://royalrangers.com/~/-/media/F5F81CB2C829419A82139A817D8073A2.ashx"
          }
        ]
      }
    }
  ]
}
