{
  "schemaVersion": 1,
  "batchKey": "us-2026-08-13-south-09",
  "sourceRegister": "docs/research/us-outpost-cohort-south.md",
  "sourceVersion": "us-outpost-cohort-south-2026-08-13",
  "reviewedAt": "2026-08-13",
  "candidates": [
    {
      "candidateKey": "us-sw-az-way-of-life-phoenix",
      "operation": "new-listing",
      "targetHubOutpostId": null,
      "publicFacts": {
        "church": "Way of Life Church",
        "city": "Phoenix",
        "jurisdiction": "Arizona",
        "outpostNumber": null,
        "campusSuffix": null,
        "streetAddress": null,
        "postalCode": null,
        "district": "Arizona District",
        "region": "Southwest Region",
        "fcfTerritory": null,
        "languageOverlay": null,
        "programs": [],
        "meeting": null,
        "contactUrl": null,
        "fcfActivityStatus": "not-verified"
      },
      "fieldSources": {
        "church": [
          {
            "url": "https://www.wolcaz.com/",
            "label": "Way of Life Church — home",
            "checkedAt": "2026-08-13",
            "factKind": "direct"
          }
        ],
        "city": [
          {
            "url": "https://www.wolcaz.com/",
            "label": "Way of Life Church — home",
            "checkedAt": "2026-08-13",
            "factKind": "direct"
          }
        ],
        "jurisdiction": [
          {
            "url": "https://www.wolcaz.com/",
            "label": "Way of Life Church — home",
            "checkedAt": "2026-08-13",
            "factKind": "direct"
          }
        ],
        "region": [
          {
            "url": "https://www.wolcaz.com/",
            "label": "Way of Life Church — home",
            "checkedAt": "2026-08-13",
            "factKind": "derived",
            "mappingSourceUrl": "https://royalrangers.com/~/-/media/F5F81CB2C829419A82139A817D8073A2.ashx"
          }
        ],
        "district": [
          {
            "url": "https://www.wolcaz.com/",
            "label": "Way of Life Church — home",
            "checkedAt": "2026-08-13",
            "factKind": "derived",
            "mappingSourceUrl": "https://royalrangers.com/~/-/media/F5F81CB2C829419A82139A817D8073A2.ashx"
          }
        ]
      }
    },
    {
      "candidateKey": "us-sw-hi-kailua-assembly",
      "operation": "new-listing",
      "targetHubOutpostId": null,
      "publicFacts": {
        "church": "Kailua Assembly of God",
        "city": "Kailua",
        "jurisdiction": "Hawaii",
        "outpostNumber": null,
        "campusSuffix": null,
        "streetAddress": null,
        "postalCode": null,
        "district": "Hawaii District",
        "region": "Southwest Region",
        "fcfTerritory": null,
        "languageOverlay": null,
        "programs": [],
        "meeting": null,
        "contactUrl": null,
        "fcfActivityStatus": "not-verified"
      },
      "fieldSources": {
        "church": [
          {
            "url": "https://kagchurch.org/ministries",
            "label": "Kailua Assembly of God — ministries",
            "checkedAt": "2026-08-13",
            "factKind": "direct"
          }
        ],
        "city": [
          {
            "url": "https://kagchurch.org/ministries",
            "label": "Kailua Assembly of God — ministries",
            "checkedAt": "2026-08-13",
            "factKind": "direct"
          }
        ],
        "jurisdiction": [
          {
            "url": "https://kagchurch.org/ministries",
            "label": "Kailua Assembly of God — ministries",
            "checkedAt": "2026-08-13",
            "factKind": "direct"
          }
        ],
        "region": [
          {
            "url": "https://kagchurch.org/ministries",
            "label": "Kailua Assembly of God — ministries",
            "checkedAt": "2026-08-13",
            "factKind": "derived",
            "mappingSourceUrl": "https://royalrangers.com/~/-/media/F5F81CB2C829419A82139A817D8073A2.ashx"
          }
        ],
        "district": [
          {
            "url": "https://kagchurch.org/ministries",
            "label": "Kailua Assembly of God — ministries",
            "checkedAt": "2026-08-13",
            "factKind": "derived",
            "mappingSourceUrl": "https://royalrangers.com/~/-/media/F5F81CB2C829419A82139A817D8073A2.ashx"
          }
        ]
      }
    },
    {
      "candidateKey": "us-sc-nm-fa-church-bernalillo",
      "operation": "new-listing",
      "targetHubOutpostId": null,
      "publicFacts": {
        "church": "FA Church",
        "city": "Bernalillo",
        "jurisdiction": "New Mexico",
        "outpostNumber": null,
        "campusSuffix": null,
        "streetAddress": null,
        "postalCode": null,
        "district": "New Mexico District",
        "region": "South Central Region",
        "fcfTerritory": null,
        "languageOverlay": null,
        "programs": [],
        "meeting": null,
        "contactUrl": null,
        "fcfActivityStatus": "not-verified"
      },
      "fieldSources": {
        "church": [
          {
            "url": "https://fabernalillo.org/",
            "label": "FA Church — home and ministries",
            "checkedAt": "2026-08-13",
            "factKind": "direct"
          }
        ],
        "city": [
          {
            "url": "https://fabernalillo.org/",
            "label": "FA Church — home and ministries",
            "checkedAt": "2026-08-13",
            "factKind": "direct"
          }
        ],
        "jurisdiction": [
          {
            "url": "https://fabernalillo.org/",
            "label": "FA Church — home and ministries",
            "checkedAt": "2026-08-13",
            "factKind": "direct"
          }
        ],
        "region": [
          {
            "url": "https://fabernalillo.org/",
            "label": "FA Church — home and ministries",
            "checkedAt": "2026-08-13",
            "factKind": "derived",
            "mappingSourceUrl": "https://royalrangers.com/~/-/media/F5F81CB2C829419A82139A817D8073A2.ashx"
          }
        ],
        "district": [
          {
            "url": "https://fabernalillo.org/",
            "label": "FA Church — home and ministries",
            "checkedAt": "2026-08-13",
            "factKind": "derived",
            "mappingSourceUrl": "https://royalrangers.com/~/-/media/F5F81CB2C829419A82139A817D8073A2.ashx"
          }
        ]
      }
    },
    {
      "candidateKey": "us-sc-ok-woodward-first-assembly",
      "operation": "new-listing",
      "targetHubOutpostId": null,
      "publicFacts": {
        "church": "Woodward First Assembly",
        "city": "Woodward",
        "jurisdiction": "Oklahoma",
        "outpostNumber": null,
        "campusSuffix": null,
        "streetAddress": null,
        "postalCode": null,
        "district": "Oklahoma District",
        "region": "South Central Region",
        "fcfTerritory": null,
        "languageOverlay": null,
        "programs": [],
        "meeting": null,
        "contactUrl": null,
        "fcfActivityStatus": "not-verified"
      },
      "fieldSources": {
        "church": [
          {
            "url": "https://woodwardfirstag.org/ministries/",
            "label": "Woodward First Assembly — ministries",
            "checkedAt": "2026-08-13",
            "factKind": "direct"
          }
        ],
        "city": [
          {
            "url": "https://woodwardfirstag.org/ministries/",
            "label": "Woodward First Assembly — ministries",
            "checkedAt": "2026-08-13",
            "factKind": "direct"
          }
        ],
        "jurisdiction": [
          {
            "url": "https://woodwardfirstag.org/ministries/",
            "label": "Woodward First Assembly — ministries",
            "checkedAt": "2026-08-13",
            "factKind": "direct"
          }
        ],
        "region": [
          {
            "url": "https://woodwardfirstag.org/ministries/",
            "label": "Woodward First Assembly — ministries",
            "checkedAt": "2026-08-13",
            "factKind": "derived",
            "mappingSourceUrl": "https://royalrangers.com/~/-/media/F5F81CB2C829419A82139A817D8073A2.ashx"
          }
        ],
        "district": [
          {
            "url": "https://woodwardfirstag.org/ministries/",
            "label": "Woodward First Assembly — ministries",
            "checkedAt": "2026-08-13",
            "factKind": "derived",
            "mappingSourceUrl": "https://royalrangers.com/~/-/media/F5F81CB2C829419A82139A817D8073A2.ashx"
          }
        ]
      }
    }
  ]
}
