{
  "schemaVersion": 1,
  "batchKey": "us-2026-08-13-south-02",
  "sourceRegister": "docs/research/us-outpost-cohort-south.md",
  "sourceVersion": "us-outpost-cohort-south-2026-08-13",
  "reviewedAt": "2026-08-13",
  "candidates": [
    {
      "candidateKey": "us-sc-tx-light-christian-center-alvin",
      "operation": "correction",
      "targetHubOutpostId": "outpost-stx-355",
      "publicFacts": {
        "church": "Light Christian Center",
        "city": "Alvin",
        "jurisdiction": "Texas",
        "outpostNumber": "355",
        "campusSuffix": null,
        "streetAddress": null,
        "postalCode": null,
        "district": "South Texas District",
        "region": "South Central Region",
        "fcfTerritory": null,
        "languageOverlay": null,
        "programs": [],
        "meeting": null,
        "contactUrl": null,
        "fcfActivityStatus": "not-verified"
      },
      "fieldSources": {
        "church": [
          {
            "url": "https://www.stxroyalrangers.com/outpost-locator/",
            "label": "South Texas Royal Rangers — Outpost Locator",
            "checkedAt": "2026-08-13",
            "factKind": "direct"
          }
        ],
        "city": [
          {
            "url": "https://www.stxroyalrangers.com/outpost-locator/",
            "label": "South Texas Royal Rangers — Outpost Locator",
            "checkedAt": "2026-08-13",
            "factKind": "direct"
          }
        ],
        "jurisdiction": [
          {
            "url": "https://www.stxroyalrangers.com/outpost-locator/",
            "label": "South Texas Royal Rangers — Outpost Locator",
            "checkedAt": "2026-08-13",
            "factKind": "direct"
          }
        ],
        "region": [
          {
            "url": "https://www.stxroyalrangers.com/outpost-locator/",
            "label": "South Texas Royal Rangers — Outpost Locator",
            "checkedAt": "2026-08-13",
            "factKind": "derived",
            "mappingSourceUrl": "https://royalrangers.com/~/-/media/F5F81CB2C829419A82139A817D8073A2.ashx"
          }
        ],
        "district": [
          {
            "url": "https://www.stxroyalrangers.com/outpost-locator/",
            "label": "South Texas Royal Rangers — Outpost Locator",
            "checkedAt": "2026-08-13",
            "factKind": "direct"
          }
        ],
        "outpostNumber": [
          {
            "url": "https://www.stxroyalrangers.com/outpost-locator/",
            "label": "South Texas Royal Rangers — Outpost Locator",
            "checkedAt": "2026-08-13",
            "factKind": "direct"
          }
        ]
      }
    },
    {
      "candidateKey": "us-sc-tx-faith-church-houston",
      "operation": "new-listing",
      "targetHubOutpostId": null,
      "publicFacts": {
        "church": "Faith Church",
        "city": "Houston",
        "jurisdiction": "Texas",
        "outpostNumber": "50",
        "campusSuffix": null,
        "streetAddress": null,
        "postalCode": null,
        "district": "South Texas District",
        "region": "South Central Region",
        "fcfTerritory": null,
        "languageOverlay": null,
        "programs": [],
        "meeting": null,
        "contactUrl": null,
        "fcfActivityStatus": "not-verified"
      },
      "fieldSources": {
        "church": [
          {
            "url": "https://www.stxroyalrangers.com/outpost-locator/",
            "label": "South Texas Royal Rangers — Outpost Locator",
            "checkedAt": "2026-08-13",
            "factKind": "direct"
          }
        ],
        "city": [
          {
            "url": "https://www.stxroyalrangers.com/outpost-locator/",
            "label": "South Texas Royal Rangers — Outpost Locator",
            "checkedAt": "2026-08-13",
            "factKind": "direct"
          }
        ],
        "jurisdiction": [
          {
            "url": "https://www.stxroyalrangers.com/outpost-locator/",
            "label": "South Texas Royal Rangers — Outpost Locator",
            "checkedAt": "2026-08-13",
            "factKind": "direct"
          }
        ],
        "region": [
          {
            "url": "https://www.stxroyalrangers.com/outpost-locator/",
            "label": "South Texas Royal Rangers — Outpost Locator",
            "checkedAt": "2026-08-13",
            "factKind": "derived",
            "mappingSourceUrl": "https://royalrangers.com/~/-/media/F5F81CB2C829419A82139A817D8073A2.ashx"
          }
        ],
        "district": [
          {
            "url": "https://www.stxroyalrangers.com/outpost-locator/",
            "label": "South Texas Royal Rangers — Outpost Locator",
            "checkedAt": "2026-08-13",
            "factKind": "direct"
          }
        ],
        "outpostNumber": [
          {
            "url": "https://www.stxroyalrangers.com/outpost-locator/",
            "label": "South Texas Royal Rangers — Outpost Locator",
            "checkedAt": "2026-08-13",
            "factKind": "direct"
          }
        ]
      }
    },
    {
      "candidateKey": "us-sc-tx-braeswood-assembly-houston",
      "operation": "new-listing",
      "targetHubOutpostId": null,
      "publicFacts": {
        "church": "Braeswood Assembly of God",
        "city": "Houston",
        "jurisdiction": "Texas",
        "outpostNumber": "60",
        "campusSuffix": null,
        "streetAddress": null,
        "postalCode": null,
        "district": "South Texas District",
        "region": "South Central Region",
        "fcfTerritory": null,
        "languageOverlay": null,
        "programs": [],
        "meeting": null,
        "contactUrl": null,
        "fcfActivityStatus": "not-verified"
      },
      "fieldSources": {
        "church": [
          {
            "url": "https://www.stxroyalrangers.com/outpost-locator/",
            "label": "South Texas Royal Rangers — Outpost Locator",
            "checkedAt": "2026-08-13",
            "factKind": "direct"
          }
        ],
        "city": [
          {
            "url": "https://www.stxroyalrangers.com/outpost-locator/",
            "label": "South Texas Royal Rangers — Outpost Locator",
            "checkedAt": "2026-08-13",
            "factKind": "direct"
          }
        ],
        "jurisdiction": [
          {
            "url": "https://www.stxroyalrangers.com/outpost-locator/",
            "label": "South Texas Royal Rangers — Outpost Locator",
            "checkedAt": "2026-08-13",
            "factKind": "direct"
          }
        ],
        "region": [
          {
            "url": "https://www.stxroyalrangers.com/outpost-locator/",
            "label": "South Texas Royal Rangers — Outpost Locator",
            "checkedAt": "2026-08-13",
            "factKind": "derived",
            "mappingSourceUrl": "https://royalrangers.com/~/-/media/F5F81CB2C829419A82139A817D8073A2.ashx"
          }
        ],
        "district": [
          {
            "url": "https://www.stxroyalrangers.com/outpost-locator/",
            "label": "South Texas Royal Rangers — Outpost Locator",
            "checkedAt": "2026-08-13",
            "factKind": "direct"
          }
        ],
        "outpostNumber": [
          {
            "url": "https://www.stxroyalrangers.com/outpost-locator/",
            "label": "South Texas Royal Rangers — Outpost Locator",
            "checkedAt": "2026-08-13",
            "factKind": "direct"
          }
        ]
      }
    },
    {
      "candidateKey": "us-sc-tx-friendship-church-richmond",
      "operation": "correction",
      "targetHubOutpostId": "outpost-stx-132",
      "publicFacts": {
        "church": "Friendship Church",
        "city": "Richmond",
        "jurisdiction": "Texas",
        "outpostNumber": "132",
        "campusSuffix": null,
        "streetAddress": null,
        "postalCode": null,
        "district": "South Texas District",
        "region": "South Central Region",
        "fcfTerritory": null,
        "languageOverlay": null,
        "programs": [],
        "meeting": null,
        "contactUrl": null,
        "fcfActivityStatus": "not-verified"
      },
      "fieldSources": {
        "church": [
          {
            "url": "https://www.stxroyalrangers.com/outpost-locator/",
            "label": "South Texas Royal Rangers — Outpost Locator",
            "checkedAt": "2026-08-13",
            "factKind": "direct"
          }
        ],
        "city": [
          {
            "url": "https://www.stxroyalrangers.com/outpost-locator/",
            "label": "South Texas Royal Rangers — Outpost Locator",
            "checkedAt": "2026-08-13",
            "factKind": "direct"
          }
        ],
        "jurisdiction": [
          {
            "url": "https://www.stxroyalrangers.com/outpost-locator/",
            "label": "South Texas Royal Rangers — Outpost Locator",
            "checkedAt": "2026-08-13",
            "factKind": "direct"
          }
        ],
        "region": [
          {
            "url": "https://www.stxroyalrangers.com/outpost-locator/",
            "label": "South Texas Royal Rangers — Outpost Locator",
            "checkedAt": "2026-08-13",
            "factKind": "derived",
            "mappingSourceUrl": "https://royalrangers.com/~/-/media/F5F81CB2C829419A82139A817D8073A2.ashx"
          }
        ],
        "district": [
          {
            "url": "https://www.stxroyalrangers.com/outpost-locator/",
            "label": "South Texas Royal Rangers — Outpost Locator",
            "checkedAt": "2026-08-13",
            "factKind": "direct"
          }
        ],
        "outpostNumber": [
          {
            "url": "https://www.stxroyalrangers.com/outpost-locator/",
            "label": "South Texas Royal Rangers — Outpost Locator",
            "checkedAt": "2026-08-13",
            "factKind": "direct"
          }
        ]
      }
    }
  ]
}
